{
  "schema_version": "flashgate-benchmark/v1",
  "benchmark_suite_version": "flashgate-benchmark-suite/v1",
  "workflow_catalog_version": "flashgate-benchmark-workflows/v1",
  "corpus_version": "flashgate-benchmark-corpus/v1",
  "project": "flashgate-mcp",
  "commit": "cfd211fa81cc48ee1dc463966718442f2ab5223c",
  "working_tree_dirty": false,
  "generated_at_utc": "2026-07-18T13:53:09.1942484Z",
  "go_version": "go1.26.4",
  "os": "windows",
  "architecture": "amd64",
  "runtime_mode": "direct_stdio",
  "transport": "stdio",
  "execution_backend": "current_process",
  "profile": "read_only",
  "parallelism": 1,
  "repetitions": 30,
  "start_measurements": {
    "first_process_start": {
      "repetitions": 1,
      "duration_ns": {
        "samples": 1,
        "min": 916872300,
        "p50": 916872300,
        "p95": 916872300,
        "max": 916872300
      },
      "request_bytes": {
        "samples": 1,
        "min": 221,
        "p50": 221,
        "p95": 221,
        "max": 221
      },
      "response_bytes": {
        "samples": 1,
        "min": 151,
        "p50": 151,
        "p95": 151,
        "max": 151
      },
      "result_bytes": {
        "samples": 1,
        "min": 116,
        "p50": 116,
        "p95": 116,
        "max": 116
      },
      "resources": {
        "status": "supported",
        "idle_working_set_bytes": {
          "samples": 1,
          "min": 6967296,
          "p50": 6967296,
          "p95": 6967296,
          "max": 6967296
        },
        "peak_working_set_bytes": {
          "samples": 1,
          "min": 6967296,
          "p50": 6967296,
          "p95": 6967296,
          "max": 6967296
        },
        "user_cpu_ns": {
          "samples": 1,
          "min": 0,
          "p50": 0,
          "p95": 0,
          "max": 0
        },
        "system_cpu_ns": {
          "samples": 1,
          "min": 15625000,
          "p50": 15625000,
          "p95": 15625000,
          "max": 15625000
        }
      },
      "exit_statuses": {
        "0": 1
      },
      "stderr_warnings": [],
      "stderr_warning_count": 0
    },
    "subsequent_process_start": {
      "repetitions": 30,
      "duration_ns": {
        "samples": 30,
        "min": 16207100,
        "p50": 17954700,
        "p95": 22415400,
        "max": 22601700
      },
      "request_bytes": {
        "samples": 30,
        "min": 221,
        "p50": 221,
        "p95": 221,
        "max": 221
      },
      "response_bytes": {
        "samples": 30,
        "min": 151,
        "p50": 151,
        "p95": 151,
        "max": 151
      },
      "result_bytes": {
        "samples": 30,
        "min": 116,
        "p50": 116,
        "p95": 116,
        "max": 116
      },
      "resources": {
        "status": "supported",
        "idle_working_set_bytes": {
          "samples": 30,
          "min": 6586368,
          "p50": 6610944,
          "p95": 6725632,
          "max": 6791168
        },
        "peak_working_set_bytes": {
          "samples": 30,
          "min": 6586368,
          "p50": 6610944,
          "p95": 6725632,
          "max": 6791168
        },
        "user_cpu_ns": {
          "samples": 30,
          "min": 0,
          "p50": 0,
          "p95": 15625000,
          "max": 31250000
        },
        "system_cpu_ns": {
          "samples": 30,
          "min": 0,
          "p50": 0,
          "p95": 15625000,
          "max": 15625000
        }
      },
      "exit_statuses": {
        "0": 30
      },
      "stderr_warnings": [],
      "stderr_warning_count": 0
    }
  },
  "resource_measurements": {
    "status": "supported",
    "idle_working_set_bytes": {
      "samples": 333,
      "min": 6586368,
      "p50": 6635520,
      "p95": 6754304,
      "max": 6967296
    },
    "peak_working_set_bytes": {
      "samples": 333,
      "min": 6586368,
      "p50": 6762496,
      "p95": 9318400,
      "max": 9437184
    },
    "user_cpu_ns": {
      "samples": 333,
      "min": 0,
      "p50": 0,
      "p95": 31250000,
      "max": 109375000
    },
    "system_cpu_ns": {
      "samples": 333,
      "min": 0,
      "p50": 15625000,
      "p95": 234375000,
      "max": 296875000
    }
  },
  "tools_list_measurements": [
    {
      "profile": "read_only",
      "tool_count": 3,
      "schema_count": 3,
      "request_bytes": 59,
      "response_bytes": 2134,
      "result_bytes": 2099,
      "approx_tokens_bytes4": 534
    },
    {
      "profile": "default",
      "tool_count": 8,
      "schema_count": 8,
      "request_bytes": 59,
      "response_bytes": 5657,
      "result_bytes": 5622,
      "approx_tokens_bytes4": 1415
    }
  ],
  "workflow_measurements": [
    {
      "name": "initialize",
      "repetitions": 30,
      "calls": 0,
      "request_bytes": {
        "samples": 30,
        "min": 221,
        "p50": 221,
        "p95": 221,
        "max": 221
      },
      "response_bytes": {
        "samples": 30,
        "min": 151,
        "p50": 151,
        "p95": 151,
        "max": 151
      },
      "result_bytes": {
        "samples": 30,
        "min": 116,
        "p50": 116,
        "p95": 116,
        "max": 116
      },
      "duration_ns": {
        "samples": 30,
        "min": 16315100,
        "p50": 18517600,
        "p95": 20693300,
        "max": 20731100
      },
      "read_bytes": {
        "samples": 30,
        "min": 0,
        "p50": 0,
        "p95": 0,
        "max": 0
      },
      "written_bytes": {
        "samples": 30,
        "min": 0,
        "p50": 0,
        "p95": 0,
        "max": 0
      },
      "scanned_bytes": {
        "samples": 30,
        "min": 0,
        "p50": 0,
        "p95": 0,
        "max": 0
      },
      "entries": {
        "samples": 30,
        "min": 0,
        "p50": 0,
        "p95": 0,
        "max": 0
      },
      "approx_tokens_bytes4": {
        "samples": 30,
        "min": 38,
        "p50": 38,
        "p95": 38,
        "max": 38
      },
      "resources": {
        "status": "supported",
        "idle_working_set_bytes": {
          "samples": 30,
          "min": 6590464,
          "p50": 6619136,
          "p95": 6791168,
          "max": 6795264
        },
        "peak_working_set_bytes": {
          "samples": 30,
          "min": 6590464,
          "p50": 6619136,
          "p95": 6791168,
          "max": 6795264
        },
        "user_cpu_ns": {
          "samples": 30,
          "min": 0,
          "p50": 0,
          "p95": 15625000,
          "max": 15625000
        },
        "system_cpu_ns": {
          "samples": 30,
          "min": 0,
          "p50": 0,
          "p95": 15625000,
          "max": 15625000
        }
      },
      "exit_statuses": {
        "0": 30
      },
      "stderr_warnings": [],
      "stderr_warning_count": 0
    },
    {
      "name": "initialize_tools_list",
      "repetitions": 30,
      "calls": 0,
      "request_bytes": {
        "samples": 30,
        "min": 280,
        "p50": 280,
        "p95": 280,
        "max": 280
      },
      "response_bytes": {
        "samples": 30,
        "min": 2285,
        "p50": 2285,
        "p95": 2285,
        "max": 2285
      },
      "result_bytes": {
        "samples": 30,
        "min": 2215,
        "p50": 2215,
        "p95": 2215,
        "max": 2215
      },
      "duration_ns": {
        "samples": 30,
        "min": 18056200,
        "p50": 19823900,
        "p95": 22182000,
        "max": 22351600
      },
      "read_bytes": {
        "samples": 30,
        "min": 0,
        "p50": 0,
        "p95": 0,
        "max": 0
      },
      "written_bytes": {
        "samples": 30,
        "min": 0,
        "p50": 0,
        "p95": 0,
        "max": 0
      },
      "scanned_bytes": {
        "samples": 30,
        "min": 0,
        "p50": 0,
        "p95": 0,
        "max": 0
      },
      "entries": {
        "samples": 30,
        "min": 0,
        "p50": 0,
        "p95": 0,
        "max": 0
      },
      "approx_tokens_bytes4": {
        "samples": 30,
        "min": 572,
        "p50": 572,
        "p95": 572,
        "max": 572
      },
      "resources": {
        "status": "supported",
        "idle_working_set_bytes": {
          "samples": 30,
          "min": 6586368,
          "p50": 6635520,
          "p95": 6746112,
          "max": 6770688
        },
        "peak_working_set_bytes": {
          "samples": 30,
          "min": 6684672,
          "p50": 6733824,
          "p95": 6868992,
          "max": 6885376
        },
        "user_cpu_ns": {
          "samples": 30,
          "min": 0,
          "p50": 0,
          "p95": 31250000,
          "max": 31250000
        },
        "system_cpu_ns": {
          "samples": 30,
          "min": 0,
          "p50": 0,
          "p95": 15625000,
          "max": 31250000
        }
      },
      "exit_statuses": {
        "0": 30
      },
      "stderr_warnings": [],
      "stderr_warning_count": 0
    },
    {
      "name": "get_path_info_existing",
      "repetitions": 30,
      "calls": 1,
      "request_bytes": {
        "samples": 30,
        "min": 338,
        "p50": 338,
        "p95": 338,
        "max": 338
      },
      "response_bytes": {
        "samples": 30,
        "min": 426,
        "p50": 426,
        "p95": 426,
        "max": 426
      },
      "result_bytes": {
        "samples": 30,
        "min": 356,
        "p50": 356,
        "p95": 356,
        "max": 356
      },
      "duration_ns": {
        "samples": 30,
        "min": 17375500,
        "p50": 19755000,
        "p95": 22993600,
        "max": 24200000
      },
      "read_bytes": {
        "samples": 30,
        "min": 0,
        "p50": 0,
        "p95": 0,
        "max": 0
      },
      "written_bytes": {
        "samples": 30,
        "min": 0,
        "p50": 0,
        "p95": 0,
        "max": 0
      },
      "scanned_bytes": {
        "samples": 30,
        "min": 0,
        "p50": 0,
        "p95": 0,
        "max": 0
      },
      "entries": {